{
  "version": "0.1",
  "endpoint": "ping",
  "compared": [
    {
      "impl": "sec4",
      "endpoint": "ping",
      "targetRps": 10000,
      "requestsPerSec": 9801.5,
      "p99": "4.30ms",
      "loadGenerator": "wrk2",
      "constantRate": true,
      "rssKb": null
    },
    {
      "impl": "go",
      "endpoint": "ping",
      "targetRps": 10000,
      "requestsPerSec": 9700.1,
      "p99": "4.80ms",
      "loadGenerator": "wrk2",
      "constantRate": true,
      "rssKb": null
    }
  ],
  "leader": {
    "impl": "sec4",
    "endpoint": "ping",
    "targetRps": 10000,
    "requestsPerSec": 9801.5,
    "p99": "4.30ms",
    "loadGenerator": "wrk2",
    "constantRate": true,
    "rssKb": null
  }
}
